nID;sName;nOrder;nID_Subcategory;sInfo;sFAQ;sLaw;sSubjectOperatorName
1;Отримати довідку про несудимість;1;2;Инфо;Чаво;Закон;МВС
2;Видача картки обліку об’єкта торговельного призначення, сфери послуг та з виробництва продуктів харчування;2;21;Инфо;Чаво;Закон;Міська Рада
3;Легалізація об’єднань громадян шляхом повідомлення;3;2;Инфо;Чаво;Закон;Мінестерство юстиції
4;Видача копій, витягів з розпоряджень міського голови, рішень, прийнятих міською радою та виконавчим комітетом;4;2;Инфо;Чаво;Закон;Міська Рада
5;Надання дозволу на використання місцевої символіки (герба міста, назви чи зображення архітектурних, історичних пам’яток);5;20;Инфо;Чаво;Закон;Міська Рада
6;Видача відомостей з документації, що включена до місцевого фонду документації із землеустрою.;6;1;Инфо;Чаво;Закон;Міська Рада
7;Дозвіл на рекламний носій;7;21;Инфо;Чаво;Закон;Міська Рада
8;Надання довідки про перебування на квартирному обліку при міськвиконкомі за місцем проживання та в житлово-будівельному кооперативі.;8;1;Инфо;Чаво;Закон;Міська Рада
9;Надання довідки про перебування на обліку бажаючих отримати земельну ділянку під індивідуальне будівництво;9;1;Инфо;Чаво;Закон;Міська Рада
10;Видача витягу з технічної документації про нормативну грошову оцінку земельної ділянки;10;1;Инфо;Чаво;Закон;Міська Рада
11;Надання відомостей з Державного земельного кадастру у формі витягу з Державного земельного кадастру про земельну ділянку;11;1;Инфо;Чаво;Закон;Міська Рада
12;Присвоєння поштової адреси об’єкту нерухомого майна;12;1;Инфо;Чаво;Закон;Міська Рада
13;Видача довідок про перебування на квартирному обліку;13;1;Инфо;Чаво;Закон;Міська Рада
14;Видача завіренех копій документів;14;2;Инфо;Чаво;Закон;Державна фіскальна служба
15;Дозвіл на розміщення зовнішньої реклами;15;21;Инфо;Чаво;Закон;Міська Рада
16;Отримання дозволу на МАФ;16;21;Инфо;Чаво;Закон;Міська Рада
17;Взяття на облік громадян, які потребують поліпшення житлових умов;17;1;Инфо;Чаво;Закон;Міська Рада
18;Взяття на соціальний квартирний облік;18;1;Инфо;Чаво;Закон;Міська Рада
19;Видача дозволу на переоформлення договору найму жилого приміщення державного / комунального житлового фонду;19;1;Инфо;Чаво;Закон;Міська Рада
20;Реєстрація громадського об’єднання;20;2;Инфо;Чаво;Закон;Реєстраційна служба управління юстиції
21;Надання відповідей на звернення громадян;21;2;Инфо;Чаво;Закон;Міська Рада
22;Надання відповідей на листи підприємств, установ та організацій в межах компетенції облдержадміністрації;22;2;Инфо;Чаво;Закон;Обласна державна адміністрація
23;Надання довідок незайнятому населенню про відсутність земельних ділянок для ведення ОСГ;23;1;Инфо;Чаво;Закон;Міська Рада
24;Видача довідки про реєстрацію місця проживання/перебування особи;24;2;Инфо;Чаво;Закон;Державна міграційна служба
25;Вклеювання до паспорта громадянина України фотокартки при досягненні 25- і 45-річного віку;25;2;Инфо;Чаво;Закон;Державна міграційна служба
26;Зняття з реєстрації місця проживання;26;2;Инфо;Чаво;Закон;Державна міграційна служба
27;Оформлення і видача паспорта громадянина України замість втраченого, викраденого чи пошкодженого;27;2;Инфо;Чаво;Закон;Державна міграційна служба
28;Оформлення та видача паспорта громадянина України;28;2;Инфо;Чаво;Закон;Державна міграційна служба
29;Реєстрація місця проживання/перебування особи;29;2;Инфо;Чаво;Закон;Державна міграційна служба
30;Взяття на облік безхазяйного нерухомого майна;30;18;Инфо;Чаво;Закон;Реєстраційна служба управління юстиції
31;Внесення запису про скасування державної реєстрації прав;31;1;Инфо;Чаво;Закон;Реєстраційна служба управління юстиції
32;Державна реєстрація іншого речового права на нерухоме майно, обтяження права на нерухоме майно;32;1;Инфо;Чаво;Закон;Реєстраційна служба управління юстиції
33;Державна реєстрація права власності на нерухоме майно;33;1;Инфо;Чаво;Закон;Реєстраційна служба управління юстиції
34;Скасування запису Державного реєстру речових прав на нерухоме майно;34;1;Инфо;Чаво;Закон;Реєстраційна служба управління юстиції
35;Надання будівельних паспортів забудови земельних ділянок;35;1;Инфо;Чаво;Закон;Міська рада – Архітектурно-планувальне управління
36;Надання вихідних даних для проектування (містобудівні умови та обмеження забудови земельних ділянок);36;1;Инфо;Чаво;Закон;Міська рада – Архітектурно-планувальне управління
37;Надання паспортів прив’язки тимчасових споруд для здійснення підприємницької діяльності;37;18;Инфо;Чаво;Закон;Міська рада – Архітектурно-планувальне управління
38;Підготовка технічних висновків про вплив переобладнань на несучу спроможність конструкцій і технічний стан об’єкта нерухомості;38;1;Инфо;Чаво;Закон;Міська рада – Архітектурно-планувальне управління
39;"Видача висновку державної землевпорядної експертизи землевпорядної 
документації щодо об’єктів, які підлягають обов’язковій державній 
експертизі";39;1;Инфо;Чаво;Закон;Державне земельне агенство
40;Видача відомостей із регіонального фонду документації з землеустрою, що включена до державного фонду документації із землеустрою;40;1;Инфо;Чаво;Закон;Державне земельне агенство
41;Виправлення технічної помилки у відомостях з державного земельного кадастру, яка була допущена органом, що здійснює його ведення;41;1;Инфо;Чаво;Закон;Державне земельне агенство
42;"Внесення до Державного земельного кадастру відомостей (змін до них) про землі в 
межах території адміністративно-територіальних одиниць";42;1;Инфо;Чаво;Закон;Державне земельне агенство
43;"Внесення до Державного земельного кадастру відомостей про обмеження у 
використанні земель, встановлені законами та прийнятими відповідно до 
них нормативно-правовими актами";43;1;Инфо;Чаво;Закон;Державне земельне агенство
44;Державна реєстрація обмежень у використанні земель;44;1;Инфо;Чаво;Закон;Державне земельне агенство
45;"Надання відомостей з Державного земельного кадастру у формі викопіювань з 
кадастрової карти (плану) та іншої картографічної документації 
Державного земельного кадастру";45;1;Инфо;Чаво;Закон;Державне земельне агенство
46;"Надання відомостей з державного земельного кадастру у формі витягу з державного
земельного кадастру про землі в межах території 
адміністративно-територіальних одиниць";46;1;Инфо;Чаво;Закон;Державне земельне агенство
47;"Надання відомостей з Державного земельного кадастру у формі витягу з Державного
земельного кадастру про обмеження у використанні земель";47;1;Инфо;Чаво;Закон;Державне земельне агенство
48;Надання відомостей з Державного земельного кадастру у формі довідки, що містить узагальнену інформацію про землі (території);48;1;Инфо;Чаво;Закон;Державне земельне агенство
49;"Видача листа про прийняття рішення щодо можливості/неможливості видачі дозволу
на викиди забруднюючих речовин в атмосферне повітря стаціонарними 
джерелами суб`єкта господарювання, об`єкт якого належить до другої або 
третьої групи";49;19;Инфо;Чаво;Закон;Державна санітарно-епідеміологічна служба
50;Висновок державної санітарно - епідеміологічної експертизи діючих об’єктів (фіз.особа);50;19;Инфо;Чаво;Закон;Державна санітарно-епідеміологічна служба
51;Внесення змін до декларації про готовність об`єкта до експлуатації;51;18;Инфо;Чаво;Закон;Обласна державна адміністрація – Архітектурно-планувальна інспекція
52;Внесення змін до декларації про початок виконання будівельних робіт;52;18;Инфо;Чаво;Закон;Обласна державна адміністрація – Архітектурно-планувальна інспекція
53;Внесення змін до декларації про початок виконання підготовчих робіт;53;18;Инфо;Чаво;Закон;Обласна державна адміністрація – Архітектурно-планувальна інспекція
54;Реєстрації декларації про готовність об`єкта до експлуатації;54;18;Инфо;Чаво;Закон;Обласна державна адміністрація – Архітектурно-планувальна інспекція
55;Реєстрація декларації про початок виконання будівельних робіт;55;18;Инфо;Чаво;Закон;Обласна державна адміністрація – Архітектурно-планувальна інспекція
56;Реєстрація декларації про початок виконання підготовчих робіт;56;18;Инфо;Чаво;Закон;Обласна державна адміністрація – Архітектурно-планувальна інспекція
57;Державна реєстрація (перереєстрація) іноземних інвестицій та її анулювання;57;10;Инфо;Чаво;Закон;Обласна державна адміністрація – Департамент економічного розвитку
58;Державна реєстрація договорів (контрактів) про спільну інвестиційну діяльність за участю іноземного інвестора;58;10;Инфо;Чаво;Закон;Обласна державна адміністрація – Департамент економічного розвитку
59;Ліцензія на здійснення суб’єктами зовнішньоекономічної діяльності експорту товарів;59;10;Инфо;Чаво;Закон;Обласна державна адміністрація – Департамент економічного розвитку
60;Ліцензія на здійснення суб’єктами зовнішньоекономічної діяльності імпорту товарів;60;10;Инфо;Чаво;Закон;Обласна державна адміністрація – Департамент економічного розвитку
61;Разова (індивідуальна) ліцензія на здійснення суб’єктами зовнішньоекономічної діяльності зовнішньоекономічних операцій;61;10;Инфо;Чаво;Закон;Обласна державна адміністрація – Департамент економічного розвитку
62;"Свідоцтво про внесення суб’єкта видавничої справи до Державного реєстру видавців,
виготівників і розповсюджувачів видавничої продукції";62;20;Инфо;Чаво;Закон;Обласна державна адміністрація – Департамент інформаційної діяльності та комунікацій з громадськістю
63;Надання ордеру на видалення зелених насаджень;63;19;Инфо;Чаво;Закон;Міська рада – Департамент комунального господарства та капітального будівництва
64;Дозвіл на відновлення земельних робіт;64;18;Инфо;Чаво;Закон;Обласна державна адміністрація – Департамент культури, туризму, національностей та релігій
65;Дозвіл на внесення суб’єкта кінематографії до державного реєстру виробників, розповсюджувачів і демонстраторів фільмів;65;20;Инфо;Чаво;Закон;Обласна державна адміністрація – Департамент культури, туризму, національностей та релігій
66;Дозвіл на проведення робіт на пам’ятках місцевого значення (крім пам’яток археології), їх територіях та в зонах охорони;66;20;Инфо;Чаво;Закон;Обласна державна адміністрація – Департамент культури, туризму, національностей та релігій
67;Погодження розміщення реклами на пам’ятках місцевого значення, в межах зон охорони таких пам’яток;67;21;Инфо;Чаво;Закон;Обласна державна адміністрація – Департамент культури, туризму, національностей та релігій
68;Реєстрація дозвілів на проведення археологічних розвідок, розкопок;68;20;Инфо;Чаво;Закон;Обласна державна адміністрація – Департамент культури, туризму, національностей та релігій
69;Свідоцтво про атестацію початкових спеціалізованих мистецьких навчальних закладів;69;13;Инфо;Чаво;Закон;Обласна державна адміністрація – Департамент культури, туризму, національностей та релігій
70;Ліцензія на здійснення освітньої діяльності у сфері дошкільної освіти;70;13;Инфо;Чаво;Закон;Обласна державна адміністрація – Департамент освіти і науки
71;Ліцензія на здійснення освітньої діяльності у сфері загальної середньої освіти;71;13;Инфо;Чаво;Закон;Обласна державна адміністрація – Департамент освіти і науки
72;Ліцензія на здійснення освітньої діяльності у сфері позашкільної освіти;72;13;Инфо;Чаво;Закон;Обласна державна адміністрація – Департамент освіти і науки
73;"Переоформлення, видача копії або дубліката ліцензії на надання освітніх послуг у сфері 
загальної середньої, дошкільної, позашкільної освіти";73;13;Инфо;Чаво;Закон;Обласна державна адміністрація – Департамент освіти і науки
74;Організація об’єкта з надання ринкових послуг (ринкового об’єкта);74;18;Инфо;Чаво;Закон;Обласна державна адміністрація – Департамент споживчого ринку і сфери послуг
75;"Відомча реєстрація великотоннажних та інших технологічних транспортних засобів,
що не підлягають експлуатації на вулично-дорожній мережі загального 
користування";75;8;Инфо;Чаво;Закон;Державна служба гірничого нагляду та промислової безпеки
76;"Зняття з обліку великотоннажних та інших технологічних транспортних засобів, 
що не підлягають експлуатації на вулично-дорожній мережі загального 
користування";76;8;Инфо;Чаво;Закон;Державна служба гірничого нагляду та промислової безпеки
77;"Перереєстрація великотоннажних та інших технологічних транспортних засобів, що не 
підлягають експлуатації на вулично-дорожній мережі загального 
користування";77;8;Инфо;Чаво;Закон;Державна служба гірничого нагляду та промислової безпеки
78;"Тимчасова реєстрація великотоннажних та інших технологічних транспортних засобів,
що не підлягають експлуатації на вулично-дорожній мережі загального 
користування";78;8;Инфо;Чаво;Закон;Державна служба гірничого нагляду та промислової безпеки
79;Видача виписки з Єдиного державного реєстру юридичних осіб та фізичних осіб – підприємців;79;15;Инфо;Чаво;Закон;Реєстраційна служба управління юстиції
80;Видача витягу з Єдиного державного реєстру юридичних осіб та фізичних осіб – підприємців;80;15;Инфо;Чаво;Закон;Реєстраційна служба управління юстиції
81;Видача довідки з Єдиного державного реєстру юридичних осіб та фізичних осіб-підприємців;81;15;Инфо;Чаво;Закон;Реєстраційна служба управління юстиції
82;"Включення до Єдиного державного реєстру юридичних осіб та фізичних осіб – 
підприємців відомостей про закриття відокремленого підрозділу юридичної 
особи";82;15;Инфо;Чаво;Закон;Реєстраційна служба управління юстиції
83;"Включення до Єдиного державного реєстру юридичних осіб та фізичних осіб – 
підприємців відомостей про створення відокремленого підрозділу юридичної
особи";83;15;Инфо;Чаво;Закон;Реєстраційна служба управління юстиції
84;"Внесення до Єдиного державного реєстру юридичних осіб та фізичних осіб – 
підприємців запису про втрату оригіналів установчих документів юридичної
особи";84;15;Инфо;Чаво;Закон;Реєстраційна служба управління юстиції
85;"Державна реєстрація змін до відомостей про фізичну особу – підприємця, які 
містяться в Єдиному державному реєстрі юридичних осіб та фізичних осіб –
підприємців";85;15;Инфо;Чаво;Закон;Реєстраційна служба управління юстиції
86;Державна реєстрація змін до установчих документів юридичної особи;86;15;Инфо;Чаво;Закон;Реєстраційна служба управління юстиції
87;Державна реєстрація припинення підприємницької діяльності фізичної особи – підприємця за її рішенням;87;15;Инфо;Чаво;Закон;Реєстраційна служба управління юстиції
88;Державна реєстрація припинення юридичної особи в результаті злиття, приєднання, поділу або перетворення;88;15;Инфо;Чаво;Закон;Реєстраційна служба управління юстиції
89;Державна реєстрація припинення юридичної особи в результаті її ліквідації;89;15;Инфо;Чаво;Закон;Реєстраційна служба управління юстиції
